[
  {
    "type": "Actor",
    "id": "A1",
    "label": "EndUser",
    "categories": [
      "core"
    ],
    "description": "A single person using the application to manage personal to-do tasks on a desktop or laptop browser.",
    "justification": "Described as a single user who wants a lightweight personal task manager and interacts with tasks, categories, filters, sorting, and preferences.",
    "anchors": [
      "AN1",
      "AN2",
      "AN3",
      "AN4",
      "AN5",
      "AN6",
      "AN7",
      "AN8",
      "AN9"
    ],
    "sourceConceptIds": [
      "C1",
      "C5",
      "C7",
      "C22"
    ]
  },
  {
    "type": "Actor",
    "id": "A2",
    "label": "TodoApplication",
    "categories": [
      "core"
    ],
    "description": "The local browser-based to-do list application that stores and manages tasks and user preferences on the user’s machine.",
    "justification": "Described as a browser-based to-do list app that runs locally, stores data locally, and automatically saves changes.",
    "anchors": [
      "AN1",
      "AN2",
      "AN8",
      "AN9",
      "AN10",
      "AN13"
    ],
    "sourceConceptIds": [
      "C1",
      "C2",
      "C3",
      "C9",
      "C10",
      "C31",
      "C32",
      "C33",
      "C34",
      "C36",
      "C42"
    ]
  },
  {
    "type": "Actor",
    "id": "A3",
    "label": "SyncEngine",
    "categories": [
      "future",
      "sync"
    ],
    "description": "An optional component responsible for synchronizing task data across multiple devices in an opt-in, privacy-preserving way.",
    "justification": "Future capability mentions syncing data across multiple devices while keeping privacy and local-first behavior, implying an active synchronization mechanism.",
    "anchors": [
      "AN24"
    ],
    "sourceConceptIds": [
      "C73",
      "C74",
      "C75"
    ]
  },
  {
    "type": "Actor",
    "id": "A4",
    "label": "SuggestionEngine",
    "categories": [
      "future",
      "analytics"
    ],
    "description": "A future analytical component that generates smart suggestions for which tasks to do next based on task attributes and past behavior.",
    "justification": "Future smart suggestions feature suggests tasks to do next based on due dates, priority, or past behavior, which implies an active recommendation mechanism.",
    "anchors": [
      "AN25"
    ],
    "sourceConceptIds": [
      "C76",
      "C77",
      "C78",
      "C79"
    ]
  },
  {
    "type": "DataEntity",
    "id": "DE1",
    "label": "Task",
    "categories": [
      "core"
    ],
    "description": "A to-do item managed by the application, with at least a title and optionally a description, due date, completion status, and other attributes.",
    "justification": "Tasks are the central items in the to-do list, created, edited, completed, deleted, filtered, sorted, and persisted.",
    "anchors": [
      "AN2",
      "AN3",
      "AN5",
      "AN6",
      "AN7",
      "AN11"
    ],
    "sourceConceptIds": [
      "C7",
      "C10",
      "C11",
      "C12",
      "C13",
      "C14",
      "C21",
      "C24",
      "C38",
      "C39"
    ]
  },
  {
    "type": "DataEntity",
    "id": "DE2",
    "label": "Category",
    "categories": [
      "core"
    ],
    "description": "A simple list or label such as Work or Personal used to organize tasks, with its own lifecycle including creation, renaming, and deletion.",
    "justification": "The specification describes organizing tasks into simple lists or categories and managing those categories.",
    "anchors": [
      "AN4",
      "AN7"
    ],
    "sourceConceptIds": [
      "C15",
      "C16",
      "C17",
      "C18",
      "C19",
      "C27"
    ]
  },
  {
    "type": "DataEntity",
    "id": "DE3",
    "label": "TaskListView",
    "categories": [
      "core",
      "ui"
    ],
    "description": "The main UI representation showing all tasks in a list that is easy to scan and interact with.",
    "justification": "The main list view is explicitly described as showing all tasks and being easy to scan and interact with, and is referenced again for layout customization and saved views.",
    "anchors": [
      "AN5",
      "AN20",
      "AN26"
    ],
    "sourceConceptIds": [
      "C20",
      "C21",
      "C60",
      "C83"
    ]
  },
  {
    "type": "DataEntity",
    "id": "DE4",
    "label": "FilterSettings",
    "categories": [
      "core",
      "ui"
    ],
    "description": "The configuration of filters applied to the task list, including completion status and category filters, which can be remembered between sessions.",
    "justification": "Filtering by completion status and category is specified, and user preferences for filters should be remembered to provide a useful default view.",
    "anchors": [
      "AN7",
      "AN8"
    ],
    "sourceConceptIds": [
      "C26",
      "C27",
      "C31",
      "C33"
    ]
  },
  {
    "type": "DataEntity",
    "id": "DE5",
    "label": "SortSettings",
    "categories": [
      "core",
      "ui"
    ],
    "description": "The configuration of sort options for tasks, such as sorting by creation time, due date, or title, which can be persisted and reused.",
    "justification": "Sorting by different criteria is described, and sorting preferences should be remembered as part of the default view.",
    "anchors": [
      "AN7",
      "AN8"
    ],
    "sourceConceptIds": [
      "C28",
      "C29",
      "C30",
      "C32",
      "C33"
    ]
  },
  {
    "type": "DataEntity",
    "id": "DE6",
    "label": "DefaultViewConfiguration",
    "categories": [
      "core",
      "ui"
    ],
    "description": "The saved combination of filters, sorting, and possibly layout that determines how the app opens in a useful default view.",
    "justification": "The app should remember preferences for filters and sorting so it opens in a useful default view, and future features reference saved views and user-defined layouts.",
    "anchors": [
      "AN8",
      "AN20",
      "AN26"
    ],
    "sourceConceptIds": [
      "C31",
      "C32",
      "C33",
      "C60",
      "C61",
      "C83"
    ]
  },
  {
    "type": "DataEntity",
    "id": "DE7",
    "label": "LocalTaskStore",
    "categories": [
      "core",
      "persistence"
    ],
    "description": "The locally stored collection of tasks and related configuration that persists between browser sessions on the user’s machine.",
    "justification": "All data remains on the local machine, with local data storage and automatic saving to ensure tasks persist between sessions.",
    "anchors": [
      "AN2",
      "AN9",
      "AN10",
      "AN13"
    ],
    "sourceConceptIds": [
      "C3",
      "C9",
      "C10",
      "C34",
      "C36",
      "C42"
    ]
  },
  {
    "type": "DataEntity",
    "id": "DE8",
    "label": "TaskPriority",
    "categories": [
      "future"
    ],
    "description": "A simple priority level assigned to a task, such as Low, Medium, or High, often represented with visual cues.",
    "justification": "Future wish list includes task priorities with simple priority levels and visual cues.",
    "anchors": [
      "AN17",
      "AN25"
    ],
    "sourceConceptIds": [
      "C52",
      "C53",
      "C78"
    ]
  },
  {
    "type": "DataEntity",
    "id": "DE9",
    "label": "Reminder",
    "categories": [
      "future"
    ],
    "description": "A local reminder associated with a task’s due date, potentially triggering a pop-up or system notification.",
    "justification": "Future feature specifies local reminders for due dates to avoid forgetting tasks.",
    "anchors": [
      "AN18"
    ],
    "sourceConceptIds": [
      "C54"
    ]
  },
  {
    "type": "DataEntity",
    "id": "DE10",
    "label": "Notification",
    "categories": [
      "future"
    ],
    "description": "A local pop-up or system notification used to alert the user about reminders or due tasks.",
    "justification": "Reminders and notifications include pop-up and system notifications for due dates.",
    "anchors": [
      "AN18"
    ],
    "sourceConceptIds": [
      "C55",
      "C56"
    ]
  },
  {
    "type": "DataEntity",
    "id": "DE11",
    "label": "RecurringTask",
    "categories": [
      "future"
    ],
    "description": "A task configured to repeat automatically according to a recurrence pattern such as daily, weekly, monthly, or custom.",
    "justification": "The spec describes recurring tasks with the ability to set tasks to repeat according to patterns.",
    "anchors": [
      "AN19"
    ],
    "sourceConceptIds": [
      "C57",
      "C58"
    ]
  },
  {
    "type": "DataEntity",
    "id": "DE12",
    "label": "RecurrencePattern",
    "categories": [
      "future"
    ],
    "description": "The schedule pattern for a recurring task, such as daily, weekly, monthly, or a custom pattern.",
    "justification": "Future capability explicitly lists recurrence patterns including daily, weekly, monthly, and custom.",
    "anchors": [
      "AN19"
    ],
    "sourceConceptIds": [
      "C58"
    ]
  },
  {
    "type": "DataEntity",
    "id": "DE13",
    "label": "Tag",
    "categories": [
      "future"
    ],
    "description": "A label attached to tasks, in addition to categories, that supports richer organization and flexible grouping.",
    "justification": "Richer organization includes tags in addition to categories.",
    "anchors": [
      "AN20"
    ],
    "sourceConceptIds": [
      "C59"
    ]
  },
  {
    "type": "DataEntity",
    "id": "DE14",
    "label": "SavedView",
    "categories": [
      "future",
      "ui"
    ],
    "description": "A stored configuration of filters, sorting, and possibly layout that can be recalled, such as Today, This Week, or High Priority.",
    "justification": "Future feature describes saved views like Today, This Week, and High Priority.",
    "anchors": [
      "AN20"
    ],
    "sourceConceptIds": [
      "C60",
      "C61"
    ]
  },
  {
    "type": "DataEntity",